{
  "schemaVersion": 1,
  "profile": "AutomationTest-TH100",
  "evidenceLevel": "known-answer",
  "reviewMode": "single-model",
  "sources": [
    {
      "type": "official-document",
      "reference": "automation/examples/AutomationTest-TH100-protocol.txt",
      "citation": "Fictional protocol used as the canonical automation format example"
    }
  ],
  "robustness": {
    "checkTruncation": true,
    "checkUnknownFPort": true
  },
  "testCases": [
    {
      "name": "Normal reading",
      "fPort": 10,
      "input": "0100EB01E65F00",
      "expectedOutput": [
        { "name": "Temperature", "channel": 1, "value": 23.5, "unit": "degreesCelsius" },
        { "name": "Humidity", "channel": 2, "value": 48.6, "unit": "percent" },
        { "name": "Battery Level", "channel": 3, "value": 95, "unit": "percent" },
        { "name": "High Temperature Alarm", "channel": 4, "value": 0, "unit": null },
        { "name": "Low Battery Alarm", "channel": 5, "value": 0, "unit": null }
      ]
    },
    {
      "name": "Negative temperature and low battery alarm",
      "fPort": 10,
      "input": "01FFCC02D31202",
      "expectedOutput": [
        { "name": "Temperature", "channel": 1, "value": -5.2, "unit": "degreesCelsius" },
        { "name": "Humidity", "channel": 2, "value": 72.3, "unit": "percent" },
        { "name": "Battery Level", "channel": 3, "value": 18, "unit": "percent" },
        { "name": "High Temperature Alarm", "channel": 4, "value": 0, "unit": null },
        { "name": "Low Battery Alarm", "channel": 5, "value": 1, "unit": null }
      ]
    },
    {
      "name": "High temperature alarm",
      "fPort": 10,
      "input": "01015F01905001",
      "expectedOutput": [
        { "name": "Temperature", "channel": 1, "value": 35.1, "unit": "degreesCelsius" },
        { "name": "Humidity", "channel": 2, "value": 40, "unit": "percent" },
        { "name": "Battery Level", "channel": 3, "value": 80, "unit": "percent" },
        { "name": "High Temperature Alarm", "channel": 4, "value": 1, "unit": null },
        { "name": "Low Battery Alarm", "channel": 5, "value": 0, "unit": null }
      ]
    }
  ]
}
